{
  "language_code": "es",
  "language_name_en": "Spanish",
  "morphology_strategy": "mixed",
  "default_script": "Latn",
  "writing_direction": "ltr",
  "word_segmentation_behavior": "space_separated",
  "tokenizer_type": "whitespace_punct",
  "politeness_system_supported": true,
  "classifier_behavior": "none",
  "supported_feature_layers": ["base", "possessor", "clitic"],
  "supported_cases": [],
  "supported_genders_or_classes": ["masculine", "feminine"]
}
